{
  "$schema": "https://json-schema.org/draft/2020-12/schema",
  "title": "Class Definition",
  "type": "object",
  "additionalProperties": false,
  "properties": {
    "class_id": {
      "type": "string",
      "pattern": "^[a-z0-9_\\-]{2,64}$"
    },
    "version": {
      "type": "string",
      "pattern": "^[0-9]+\\.[0-9]+\\.[0-9]+$"
    },
    "name": {
      "type": "string",
      "minLength": 1
    },
    "description": {
      "type": "string"
    },
    "tags": {
      "type": "array",
      "items": {
        "type": "string"
      }
    },
    "level_cap": {
      "type": "integer",
      "minimum": 1,
      "maximum": 200
    },
    "allowed_races": {
      "type": "array",
      "items": {
        "type": "string"
      }
    },
    "base_attributes": {
      "type": "object",
      "additionalProperties": false,
      "properties": {
        "str": {
          "type": "integer",
          "minimum": 1,
          "maximum": 30
        },
        "dex": {
          "type": "integer",
          "minimum": 1,
          "maximum": 30
        },
        "int": {
          "type": "integer",
          "minimum": 1,
          "maximum": 30
        },
        "wis": {
          "type": "integer",
          "minimum": 1,
          "maximum": 30
        },
        "con": {
          "type": "integer",
          "minimum": 1,
          "maximum": 30
        },
        "cha": {
          "type": "integer",
          "minimum": 1,
          "maximum": 30
        }
      },
      "required": [
        "str",
        "dex",
        "int",
        "wis",
        "con",
        "cha"
      ]
    },
    "per_level_gains": {
      "type": "object",
      "additionalProperties": false,
      "properties": {
        "hp": {
          "type": "integer",
          "minimum": 0,
          "maximum": 1000
        },
        "mp": {
          "type": "integer",
          "minimum": 0,
          "maximum": 1000
        },
        "stamina": {
          "type": "integer",
          "minimum": 0,
          "maximum": 1000
        },
        "stat_points": {
          "type": "integer",
          "minimum": 0,
          "maximum": 10
        }
      },
      "required": [
        "hp",
        "mp",
        "stamina",
        "stat_points"
      ]
    },
    "skills": {
      "type": "object",
      "additionalProperties": {
        "type": "object",
        "properties": {
          "start": {
            "type": "number"
          },
          "per_level": {
            "type": "number"
          }
        },
        "required": [
          "start",
          "per_level"
        ],
        "additionalProperties": false
      }
    },
    "abilities": {
      "type": "array",
      "items": {
        "type": "object",
        "additionalProperties": false,
        "properties": {
          "ability_id": {
            "type": "string"
          },
          "name": {
            "type": "string"
          },
          "unlock_level": {
            "type": "integer",
            "minimum": 1
          },
          "rank_cap": {
            "type": "integer",
            "minimum": 1,
            "maximum": 10
          },
          "scaling": {
            "type": "object",
            "additionalProperties": false,
            "properties": {
              "stat": {
                "type": "string",
                "enum": [
                  "str",
                  "dex",
                  "int",
                  "wis",
                  "con",
                  "cha"
                ]
              },
              "factor": {
                "type": "number",
                "minimum": 0
              }
            },
            "required": [
              "stat",
              "factor"
            ]
          }
        },
        "required": [
          "ability_id",
          "name",
          "unlock_level",
          "rank_cap",
          "scaling"
        ]
      }
    },
    "starting_equipment": {
      "type": "array",
      "items": {
        "type": "string"
      }
    },
    "notes": {
      "type": "string"
    },
    "created_at": {
      "type": "string"
    },
    "updated_at": {
      "type": "string"
    }
  },
  "required": [
    "class_id",
    "version",
    "name",
    "level_cap",
    "base_attributes",
    "per_level_gains",
    "abilities"
  ]
}